{
  "schema_version": "1.0",
  "artifact_kind": "pooleos_native_kernel_xstate_exception_contract",
  "contract_id": "PKXEXC1",
  "selected_move_id": "N7-XSTATE-EXCEPTION-001",
  "status_date": "2026-07-28",
  "status": "frozen_bounded_bsp_x87_simd_exception_non_promoting",
  "production_ready": false,
  "production_promotion_allowed": false,
  "phase_mapping": [
    "N7.4",
    "ADD-N7-XSTATE-001"
  ],
  "development_profile": {
    "feature": "development-xstate-exception",
    "selector": 6,
    "machine": "pc-q35-11.0",
    "cpu_model": "EPYC-Rome-v4,-avx,-avx2,-fma,-f16c,-pku",
    "acceleration": "whpx_hardware_accelerated",
    "bsp_only": true,
    "emulator_only": false,
    "hardware_accelerated_virtual_machine_only": true,
    "observed_host_cpu": "AMD Ryzen 7 9800X3D 8-Core Processor",
    "base_tier0_profile_modified": false
  },
  "exception_policy": {
    "parent_contract": "PKXSTATE1",
    "delivery_sequence": [16, 19, 7],
    "x87_vector": 16,
    "x87_exception": "invalid_operation_zero_divided_by_zero",
    "x87_invalid_fcw": 894,
    "x87_recovery": "FNINIT_then_exact_resume",
    "simd_vector": 19,
    "simd_exception": "scalar_single_invalid_operation_zero_divided_by_zero",
    "simd_invalid_mxcsr": 7936,
    "simd_recovery": "LDMXCSR_0x1F80_then_exact_resume",
    "recoverable_vectors": [16, 19],
    "terminal_vector": 7,
    "nm_strategy": "eager_reject_test_only",
    "nm_recovery_allowed": false,
    "nm_state_sampling_allowed": false,
    "descriptor_gate_count": 8,
    "ist_index": 1,
    "error_code_for_all_three_vectors": 0,
    "interrupts_enabled": false,
    "kernel_simd_outside_allowlisted_assembly": "forbidden"
  },
  "authority_gate": {
    "privileged_configuration_writes": 4,
    "write_allowlist": ["CR0", "CR4", "XCR0", "CR0.TS_test_only"],
    "recovery_state_writes": 2,
    "recovery_write_allowlist": ["FNINIT", "LDMXCSR"],
    "msr_writes": 0,
    "signature_verifications": 0,
    "authority_grants": 0,
    "actions_authorized": 0,
    "post_exit_firmware_calls": 0,
    "physical_media_writes": 0
  },
  "qualification": {
    "qemu_run_count": 2,
    "tcg_limitation_probe_count": 1,
    "fresh_vars_per_run": true,
    "exact_marker_match_required": true,
    "exact_screenshot_match_required": true,
    "exact_handoff_match_required": true,
    "rust_python_agreement_required": true,
    "negative_control_count": 43,
    "source_instruction_audit_required": true,
    "profile_source_wrmsr_site_count": 0,
    "shared_source_wrmsr_sites_outside_profile": 2,
    "linked_machine_code_audit_required": true,
    "synthetic_disassembly_negative_required": true
  },
  "machine_code_audit_tool": {
    "component": "llvm-tools-preview",
    "relative_path": ".toolchains/rust-1.97.0/rustup/toolchains/1.97.0-x86_64-pc-windows-msvc/lib/rustlib/x86_64-pc-windows-msvc/bin/llvm-objdump.exe",
    "version": "LLVM version 22.1.6-rust-1.97.0-stable",
    "byte_count": 35279360,
    "sha256": "84DE1EDCEFED12FEB797F8B1C41DEBA99B6116A6BB3B80A1832FFF2CC06F2F94",
    "archive_url": "https://static.rust-lang.org/dist/2026-07-09/llvm-tools-1.97.0-x86_64-pc-windows-msvc.tar.xz",
    "archive_sha256": "671B509EC2C9220916D25D8FD546E71EFB552439F8E7AE75CE53208D9395DFB4",
    "license": "Apache-2.0 WITH LLVM-exception",
    "installation_scope": "workspace_local_non_administrative_untracked",
    "global_path_modified": false,
    "provenance": "official Rust 1.97.0 distribution component installed by workspace-local rustup"
  },
  "source_register": [
    {
      "id": "AMD-APM-VOL2-24593-3.44",
      "authority": "AMD",
      "publication": "24593",
      "revision": "3.44",
      "date": "March 2026",
      "title": "AMD64 Architecture Programmer's Manual Volume 2: System Programming",
      "url": "https://docs.amd.com/v/u/en-US/24593_3.44_APM_Vol2",
      "capture_url": "https://docs.amd.com/api/khub/documents/sD1_QL~h4Afq2_tvzxqqSQ/content",
      "captured_byte_count": 12560767,
      "captured_sha256": "3D9DCB3F68222392D0EDE9970EFC95E31A047A247D54B454123D6981D278C48C",
      "redistributed": false,
      "target_applicable": true,
      "bound_topics": [
        "vector_7_device_not_available",
        "vector_16_x87_floating_point_exception",
        "vector_19_simd_floating_point_exception"
      ]
    },
    {
      "id": "QEMU-ISSUE-215",
      "authority": "QEMU Project",
      "issue": 215,
      "status": "open_observed_2026-07-21",
      "title": "x86 Floating point exceptions - incorrect support?",
      "url": "https://gitlab.com/qemu-project/qemu/-/issues/215",
      "observed_behavior": "TCG sets the unmasked MXCSR invalid status bit but does not inject vector 19",
      "hardware_acceleration_behavior": "reported to deliver the hardware floating-point exception",
      "redistributed": false,
      "target_applicable": false,
      "bound_topics": ["qemu_tcg_x87_sse_exception_limitation"]
    }
  ],
  "required_negative_controls": [
    "NEG-N7-PKXEXC-MARKER-OMISSION",
    "NEG-N7-PKXEXC-MARKER-ORDER",
    "NEG-N7-PKXEXC-MARKER-DUPLICATE",
    "NEG-N7-PKXEXC-SELECTOR",
    "NEG-N7-PKXEXC-CONTRACT",
    "NEG-N7-PKXEXC-PARENT",
    "NEG-N7-PKXEXC-GATES",
    "NEG-N7-PKXEXC-VECTORS",
    "NEG-N7-PKXEXC-IST",
    "NEG-N7-PKXEXC-XCR0",
    "NEG-N7-PKXEXC-CR0",
    "NEG-N7-PKXEXC-CR4",
    "NEG-N7-PKXEXC-PARENT-WRITES",
    "NEG-N7-PKXEXC-DEFAULT-MASKS",
    "NEG-N7-PKXEXC-SEQUENCE",
    "NEG-N7-PKXEXC-X87-FCW-ARM",
    "NEG-N7-PKXEXC-SIMD-MXCSR-ARM",
    "NEG-N7-PKXEXC-NM-STRATEGY",
    "NEG-N7-PKXEXC-X87-VECTOR",
    "NEG-N7-PKXEXC-X87-ERROR",
    "NEG-N7-PKXEXC-X87-STATUS",
    "NEG-N7-PKXEXC-X87-RECOVERY",
    "NEG-N7-PKXEXC-X87-RETURN",
    "NEG-N7-PKXEXC-SIMD-VECTOR",
    "NEG-N7-PKXEXC-SIMD-STATUS",
    "NEG-N7-PKXEXC-SIMD-RECOVERY",
    "NEG-N7-PKXEXC-SIMD-RETURN",
    "NEG-N7-PKXEXC-NM-ARM",
    "NEG-N7-PKXEXC-NM-VECTOR",
    "NEG-N7-PKXEXC-NM-INJECTION",
    "NEG-N7-PKXEXC-NM-SAMPLING",
    "NEG-N7-PKXEXC-NM-RECOVERY",
    "NEG-N7-PKXEXC-DELIVERY-COUNT",
    "NEG-N7-PKXEXC-RECOVERY-COUNT",
    "NEG-N7-PKXEXC-WRITE-COUNT",
    "NEG-N7-PKXEXC-UNEXPECTED",
    "NEG-N7-PKXEXC-AUTHORITY",
    "NEG-N7-PKXEXC-SCHEDULER-CLAIM",
    "NEG-N7-PKXEXC-SMP-CLAIM",
    "NEG-N7-PKXEXC-TARGET-CLAIM",
    "NEG-N7-PKXEXC-SOURCE-AUDIT",
    "NEG-N7-PKXEXC-MACHINE-CODE-AUDIT",
    "NEG-N7-PKXEXC-LLVM-BINDING"
  ],
  "claims": {
    "parent_x87_sse_xsave_policy_revalidated": true,
    "x87_invalid_exception_delivered_and_recovered": true,
    "simd_invalid_exception_delivered_and_recovered": true,
    "eager_nm_policy_rejection_delivered": true,
    "exact_resume_sites_observed": true,
    "linked_machine_code_scope_audited": true,
    "qemu_tcg_xm_non_delivery_limitation_observed": true,
    "rust_python_policy_agreement": true,
    "two_qemu_runs_exact_match": true,
    "lazy_nm_recovery_qualified": false,
    "scheduler_context_switch_integrated": false,
    "smp_or_cpu_migration_qualified": false,
    "target_cpu_qualified": false,
    "n7_exit_gate_satisfied": false,
    "production_ready": false
  },
  "non_claims": [
    "PKXEXC1 is a single-BSP QEMU development profile and does not qualify the Ryzen 7 9800X3D target.",
    "The deliberate CR0.TS write and #NM are test-only proof injections; PooleKernel retains the eager strategy and does not implement lazy restore or #NM recovery.",
    "The #MF and #XM handlers recover only the deliberately generated invalid-operation cases and do not yet establish a complete floating-point exception policy for user tasks.",
    "The linked audit is bounded to the exact Cycle 136 integrated linked image and its allowlisted xstate assembly scopes; its source audit records zero WRMSR sites in the PKXEXC1 profile and two separately qualified shared-image sites outside that profile, and it is not a general proof about future compiler versions or binaries.",
    "No scheduler, thread lifecycle, user-mode fault delivery, SMP, AP initialization, CPU migration, AVX state, or target-hardware behavior is integrated or claimed.",
    "No key, signature, capability grant, firmware mutation, physical-media write, release, production promotion, or public key publication is performed or claimed."
  ]
}
